CreatedAt,ID,ActualTweet,Source,Truncated,InReplyToStatusID,InReplyToUserID,InReplyToScreenName,UserID,UserScreenName,GEO,Coordinates,PlaceID,PlaceURL,PlaceType,PlaceName,PlaceFullName,PlaceCountryCode,PlaceCountry,Contributors,RetweetCount,FavouriteCount,Hashtags,Symbols,URL,URLInTweetExpanded,Indices,MediaIndices,MediaURL,MediaURLShort,MediaType,UserMentionScreenName,UserMentionName,UserMentionID,Favourited,Retweeted,PossiblySensitive,Language,Classifier,TweetLength
Wed Jul 02 12:22:08 +0000 2014,484311057180418049,"RT @TimHowardGK: Biden/Howard 2016, the dream ticket!! Lol http://t.co/Kyed8WwdfX","<a href=""http://twitter.com"" rel=""nofollow"">Twitter Web Client</a>",false,,,,620142261,KimKierkegaard,,,,,,,,,,,1380,0,,,,,,81,http://pbs.twimg.com/media/BqbuWdcCMAA66QE.jpg,http://t.co/Kyed8WwdfX,photo,TimHowardGK,tim howard,2511477648,false,false,false,en,0,81
Sun Jun 22 15:10:38 +0000 2014,480729580488376320,"The sea struck up its song with a deep, calm solemnity. The souls of the dead came forth to hold me in their comforting embrace. Yacht life.","<a href=""http://twitter.com"" rel=""nofollow"">Twitter Web Client</a>",false,,,,620142261,KimKierkegaard,,,,,,,,,,,1093,860,,,,,,,,,,,,,false,false,,en,0,134
Fri Jun 20 14:28:09 +0000 2014,479994113295937537,Thank you Balmain for the custom rope dress! Only constraint can help a man to freedom.,"<a href=""http://twitter.com"" rel=""nofollow"">Twitter Web Client</a>",false,,,,620142261,KimKierkegaard,,,,,,,,,,,285,302,,,,,,,,,,,,,false,false,,en,0,87
Thu Jun 19 23:57:05 +0000 2014,479774903798099969,@BananaKarenina !! Brings back painful (yet tender) memories. How she used to hiss and hiss at me!,"<a href=""http://twitter.com"" rel=""nofollow"">Twitter Web Client</a>",false,479772471143317505,541101047,BananaKarenina,620142261,KimKierkegaard,,,,,,,,,,,2,4,,,,,,,,,,BananaKarenina,Elif Batuman,541101047,false,false,,en,0,98
Thu Jun 19 23:31:07 +0000 2014,479768368682373120,"@BananaKarenina Madagascar hissing cockroaches are actually quite sweet, though a little ""clingy.""","<a href=""http://twitter.com"" rel=""nofollow"">Twitter Web Client</a>",false,479767214464053248,541101047,BananaKarenina,620142261,KimKierkegaard,,,,,,,,,,,1,3,,,,,,,,,,BananaKarenina,Elif Batuman,541101047,false,false,,en,0,98
Thu Jun 19 21:04:31 +0000 2014,479731475848642561,RT @erinmdurkin: .@BilldeBlasio administration comes out in support of the car wash licensing bill.,"<a href=""http://twitter.com"" rel=""nofollow"">Twitter Web Client</a>",false,,,,620142261,KimKierkegaard,,,,,,,,,,,6,0,,,,,,,,,,BilldeBlasio,Bill de Blasio,19834403,false,false,,en,0,99
Thu Jun 19 21:04:27 +0000 2014,479731460656889856,"RT @erinmdurkin: .@MMViverito: Carwash workers ""do not always get paid the min wage, seldom get overtime...have tips taken from them right ?","<a href=""http://twitter.com"" rel=""nofollow"">Twitter Web Client</a>",false,,,,620142261,KimKierkegaard,,,,,,,,,,,6,0,,,,,,,,,,MMViverito,Melissa MarkViverito,94013297,false,false,,en,0,134
Thu Jun 19 15:53:38 +0000 2014,479653239760375808,I change up my makeup a lot. I am completely dialectical.,"<a href=""http://twitter.com"" rel=""nofollow"">Twitter Web Client</a>",false,,,,620142261,KimKierkegaard,,,,,,,,,,,243,230,,,,,,,,,,,,,false,false,,en,0,57
Wed Jun 18 16:05:17 +0000 2014,479293784858320896,"When I step out from my lonely suffering and walk among happy people, it's the epitome of timeless chic.","<a href=""http://twitter.com"" rel=""nofollow"">Twitter Web Client</a>",false,,,,620142261,KimKierkegaard,,,,,,,,,,,455,396,,,,,,,,,,,,,false,false,,en,0,104
Tue Jun 17 22:23:22 +0000 2014,479026541561925632,"I love your Tumblr's infinite scroll-down feature &amp; the unfathomable, insatiable emptiness behind it.","<a href=""http://twitter.com"" rel=""nofollow"">Twitter Web Client</a>",false,,,,620142261,KimKierkegaard,,,,,,,,,,,1422,1262,,,,,,,,,,,,,false,false,,en,0,105
Mon Jun 16 18:30:01 +0000 2014,478605432953778176,"Those who speak to the crowd, coveting its approval, must be regarded as being worse than prostitutes. Oh, hey 100,000 people!","<a href=""http://twitter.com"" rel=""nofollow"">Twitter Web Client</a>",false,,,,620142261,KimKierkegaard,,,,,,,,,,,314,307,,,,,,,,,,,,,false,false,,en,0,126
Mon Jun 16 04:03:28 +0000 2014,478387355234340864,RT @Esquiremag: How to Quit Amazon and Shop in an Actual Bookstore (in 4 Easy Steps) http://t.co/gn5bpLpwT0 by @StephenMarche,"<a href=""http://twitter.com"" rel=""nofollow"">Twitter Web Client</a>",false,,,,620142261,KimKierkegaard,,,,,,,,,,,79,0,,,http://t.co/gn5bpLpwT0,http://esqm.ag/6011cU9U,107,,,,,StephenMarche,Stephen Marche,233930147,false,false,false,en,0,125
Sat Jun 14 18:54:29 +0000 2014,477886812216893441,Look what I found in my luggage!!! All my worldly troubles and sorrows.,"<a href=""http://twitter.com"" rel=""nofollow"">Twitter Web Client</a>",false,,,,620142261,KimKierkegaard,,,,,,,,,,,729,682,,,,,,,,,,,,,false,false,,en,0,71
Sat Jun 14 15:30:12 +0000 2014,477835404037853184,My look is never complete without indescribable suffering.,"<a href=""http://twitter.com"" rel=""nofollow"">Twitter Web Client</a>",false,,,,620142261,KimKierkegaard,,,,,,,,,,,1445,1083,,,,,,,,,,,,,false,false,,en,0,58
Fri Jun 13 18:49:55 +0000 2014,477523275044913153,Kim Kierkegaardashian endorses! MT @MaketheRoadNY Why should YOU donate to our immigrant rights work? http://t.co/70LN9SYfMX,"<a href=""http://twitter.com"" rel=""nofollow"">Twitter Web Client</a>",false,,,,620142261,KimKierkegaard,,,,,,,,,,,2,7,,,http://t.co/70LN9SYfMX,http://bit.ly/MRNYtamiko,124,,,,,MaketheRoadNY,MaketheRoadNewYork,141286022,false,false,false,en,0,124
Fri Jun 13 14:34:47 +0000 2014,477459069779714049,One must work some time in darkness before the light bursts through &amp; the sun shines forth in all its glory. Tan time! So excited.,"<a href=""http://twitter.com"" rel=""nofollow"">Twitter Web Client</a>",false,,,,620142261,KimKierkegaard,,,,,,,,,,,938,632,,,,,,,,,,,,,false,false,,en,0,134
Thu Jun 12 14:12:18 +0000 2014,477091021772570625,"A man does not arrive at wisdom as a matter of course, but through sexy bikinis, beaches, and boat rides.","<a href=""http://twitter.com"" rel=""nofollow"">Twitter Web Client</a>",false,,,,620142261,KimKierkegaard,,,,,,,,,,,542,410,,,,,,,,,,,,,false,false,,en,0,105
Wed Jun 11 20:14:42 +0000 2014,476819838099550210,@HephzibahA Why I recommend waxing your knuckles rather than shaving them.,"<a href=""http://twitter.com"" rel=""nofollow"">Twitter Web Client</a>",false,476181049048068096,21260277,HephzibahA,620142261,KimKierkegaard,,,,,,,,,,,0,10,,,,,,,,,,HephzibahA,Hephzibah Anderson,21260277,false,false,,en,0,74
Tue Jun 10 05:07:31 +0000 2014,476229146205769728,"We love selfies! The despairing self, by taking notice of itself, tries to make itself more than it already is.","<a href=""http://twitter.com"" rel=""nofollow"">Twitter Web Client</a>",false,,,,620142261,KimKierkegaard,,,,,,,,,,,1808,1160,,,,,,,,,,,,,false,false,,en,0,111
Tue Jun 10 04:35:57 +0000 2014,476221204244992002,"""Tween cattle rustler"" is a good look for summer. RT @BananaKarenina Dear @TweenHobo! TY for the swag! http://t.co/yx4qig8atO","<a href=""http://twitter.com"" rel=""nofollow"">Twitter Web Client</a>",false,476106201638649856,541101047,BananaKarenina,620142261,KimKierkegaard,,,,,,,,,,,4,26,,,,,,125,http://pbs.twimg.com/media/Bpt4EVJIMAE4nrl.jpg,http://t.co/yx4qig8atO,photo,TweenHobo,Tween Hobo,427588306,false,false,false,en,0,125
Mon Jun 02 19:44:53 +0000 2014,473550841610518528,Should I use my sins to terrify the public?Or should I keep this terror hidden in my innermost being? Trying on a few looks 2 see what works,"<a href=""http://twitter.com"" rel=""nofollow"">Twitter Web Client</a>",false,,,,620142261,KimKierkegaard,,,,,,,,,,,929,651,,,,,,,,,,,,,false,false,,en,0,134
Sun Jun 01 19:26:18 +0000 2014,473183778102583296,"Balmain made this crazy tapestry dress of all stones, to give my contemporaries a hint of the heavy burdens I bear within myself.","<a href=""http://twitter.com"" rel=""nofollow"">Twitter Web Client</a>",false,,,,620142261,KimKierkegaard,,,,,,,,,,,511,470,,,,,,,,,,,,,false,false,,en,0,134
Fri May 30 17:14:28 +0000 2014,472425823363170304,"RT @charugan: The third place winner (loser?) of the spelling bee went out on the word ""Kierkegaardian"".","<a href=""http://twitter.com"" rel=""nofollow"">Twitter Web Client</a>",false,,,,620142261,KimKierkegaard,,,,,,,,,,,35,0,,,,,,,,,,charugan,Landon Rordam,75862435,false,false,,en,0,104
Thu May 29 21:31:18 +0000 2014,472128072368799745,"The task is not to find the lovable object. It is rather to find the object lovable, just by adding a fun lip color.","<a href=""http://twitter.com"" rel=""nofollow"">Twitter Web Client</a>",false,,,,620142261,KimKierkegaard,,,,,,,,,,,778,546,,,,,,,,,,,,,false,false,,en,0,116
Thu May 29 00:01:58 +0000 2014,471803598956154880,"Love is not intense feelings or a full heart. Love is rather the work of love, and I have had a busy week.","<a href=""http://twitter.com"" rel=""nofollow"">Twitter Web Client</a>",false,,,,620142261,KimKierkegaard,,,,,,,,,,,341,326,,,,,,,,,,,,,false,false,,en,0,106
Fri May 23 17:35:37 +0000 2014,469894433924993024,"For events, I like to pair bold lashes with a gnawing sense of futility.","<a href=""http://twitter.com"" rel=""nofollow"">Twitter Web Client</a>",false,,,,620142261,KimKierkegaard,,,,,,,,,,,1764,1154,,,,,,,,,,,,,false,false,,en,0,72
Wed May 21 00:31:14 +0000 2014,468911860277055489,"RT @barerliterary: Great piece by @magiciansbook about why we all should try &amp; quit shopping at Amazon. I'm going to, will you? http://t.co?","<a href=""http://twitter.com"" rel=""nofollow"">Twitter Web Client</a>",false,,,,620142261,KimKierkegaard,,,,,,,,,,,31,0,,,http://t.co/gpRYzSYcqb,http://slnm.us/UKf7lFb,144,,,,,magiciansbook,Laura Miller,15985960,false,false,false,en,0,134
Tue May 20 01:15:01 +0000 2014,468560493624315906,@AragiAuthorNews @anissahelou @eccobooks I would do it.,"<a href=""http://twitter.com"" rel=""nofollow"">Twitter Web Client</a>",false,468535540107603968,256073990,AragiAuthorNews,620142261,KimKierkegaard,,,,,,,,,,,1,1,,,,,,,,,,eccobooks,Ecco Books,25687502,false,false,,en,0,55
Mon May 19 13:49:16 +0000 2014,468387918965268480,Khloe sets the #YOLO bar pretty high. But she loses the present in the constant anxiety about losing it.,"<a href=""http://twitter.com"" rel=""nofollow"">Twitter Web Client</a>",false,,,,620142261,KimKierkegaard,,,,,,,,,,,511,448,YOLO,,,,,,,,,,,,false,false,,en,0,104
Mon May 19 04:04:35 +0000 2014,468240776796049408,.@SalmanRushdie @RushdieExplains OMG love your work!! #TheSatanicPurses #TheMoorsFatThighs xxoo #Shame on me,"<a href=""http://twitter.com"" rel=""nofollow"">Twitter Web Client</a>",false,468129754835472386,373416209,SalmanRushdie,620142261,KimKierkegaard,,,,,,,,,,,45,83,Shame,,,,,,,,,RushdieExplains,RushdieExplainsIndia,2503480063,false,false,,en,0,108
Sun May 18 15:48:21 +0000 2014,468055498718449664,RT @melflashman: James Patterson on the war between Amazon &amp; the future of writing and reading. https://t.co/XMVQw5VWiI,"<a href=""http://twitter.com"" rel=""nofollow"">Twitter Web Client</a>",false,,,,620142261,KimKierkegaard,,,,,,,,,,,19,0,,,https://t.co/XMVQw5VWiI,https://www.facebook.com/notes/james-patterson/please-take-a-moment-to-read-this/745751215464869,123,,,,,melflashman,melissa flashman,14548848,false,false,false,en,0,123
Sun May 18 15:37:12 +0000 2014,468052691953152000,"RT @Londonhandyman1: When u start paying your way, I will buy from you again @AmazonUK #boycottamazon #youhavenoshame http://t.co/Nol23DLx0q","<a href=""http://twitter.com"" rel=""nofollow"">Twitter Web Client</a>",false,,,,620142261,KimKierkegaard,,,,,,,,,,,24,0,youhavenoshame,,http://t.co/Nol23DLx0q,http://www.theguardian.com/business/2014/may/09/margaret-hodge-urges-boycott-amazon-uk-tax-starbucks,140,,,,,AmazonUK,Amazon UK,209004862,false,false,false,en,0,134
Fri May 16 22:10:28 +0000 2014,467426886445199360,@BananaKarenina Hope you are well. We miss you!,"<a href=""http://twitter.com"" rel=""nofollow"">Twitter Web Client</a>",false,,541101047,BananaKarenina,620142261,KimKierkegaard,,,,,,,,,,,0,3,,,,,,,,,,BananaKarenina,Elif Batuman,541101047,false,false,,en,0,47
Fri May 16 21:13:39 +0000 2014,467412588536815616,RT @undeadmolly: Remember the #1 rule of time travel: don't do ANYTHING that could change the future! Simply observe or make angry comments?,"<a href=""http://twitter.com"" rel=""nofollow"">Twitter Web Client</a>",false,,,,620142261,KimKierkegaard,,,,,,,,,,,579,0,,,,,,,,,,undeadmolly,Molly Manglewood,14258196,false,false,,en,0,134
Fri May 16 16:17:27 +0000 2014,467338046376271872,"RT @MirzaWaheed: ""Indians have dreamed collectively, &amp; they have dreamed a man accused of mass murder""
Must. Pankaj Mishra on #Modi~
http:/?","<a href=""http://twitter.com"" rel=""nofollow"">Twitter Web Client</a>",false,,,,620142261,KimKierkegaard,,,,,,,,,,,69,0,Modi,,http://t.co/NdETxuU4Pf,http://www.theguardian.com/books/2014/may/16/what-next-india-pankaj-mishra,144,,,,,MirzaWaheed,Mirza Waheed,20850940,false,false,false,en,0,134
Thu May 15 23:00:33 +0000 2014,467077100080726017,RT @NYTMinusContext: throw away your work,"<a href=""http://twitter.com"" rel=""nofollow"">Twitter Web Client</a>",false,,,,620142261,KimKierkegaard,,,,,,,,,,,110,0,,,,,,,,,,NYTMinusContext,NYT Minus Context,2189503302,false,false,,en,0,41
Thu May 08 22:23:56 +0000 2014,464531171180040192,"I tried on this amazing Wes Gordon chain mail dress and oh, how alike are melancholy &amp; frivolity!","<a href=""http://twitter.com"" rel=""nofollow"">Twitter Web Client</a>",false,,,,620142261,KimKierkegaard,,,,,,,,,,,390,370,,,,,,,,,,,,,false,false,,en,0,101
Tue May 06 00:54:41 +0000 2014,463481945364901888,"Hegelian philosophy posits the thesis that the outer is the inner &amp; the inner is the outer, but I think it's elegant to twist it into a bun.","<a href=""http://twitter.com"" rel=""nofollow"">Twitter Web Client</a>",false,,,,620142261,KimKierkegaard,,,,,,,,,,,999,700,,,,,,,,,,,,,false,false,,en,0,134
Mon May 05 22:10:59 +0000 2014,463440750622302209,"RT @GordonMarino: Kierkegaard's birthday today.  Some day, he said, communication would become instantaneous but people would have nothing ?","<a href=""http://twitter.com"" rel=""nofollow"">Twitter Web Client</a>",false,,,,620142261,KimKierkegaard,,,,,,,,,,,1262,0,,,,,,,,,,GordonMarino,Gordon Marino,421380878,false,false,,en,0,134
Mon Mar 17 22:00:02 +0000 2014,445680986987458560,We wanted to create a fashion line for little girls lest they should rest too easily in the false security of youth.,"<a href=""http://twitter.com"" rel=""nofollow"">Twitter Web Client</a>",false,,,,620142261,KimKierkegaard,,,,,,,,,,,1158,844,,,,,,,,,,,,,false,false,,en,0,116
Thu Mar 13 23:12:30 +0000 2014,444249672769867776,My melancholy is the most faithful sweetheart I have had. She is one bad bitch.,"<a href=""http://twitter.com"" rel=""nofollow"">Twitter Web Client</a>",false,,,,620142261,KimKierkegaard,,,,,,,,,,,1213,971,,,,,,,,,,,,,false,false,,en,0,79
Mon Feb 24 22:44:14 +0000 2014,438081966232334338,"I will not fool myself with regard to the eternal, or shy away from truth, and I will never conform to your skinny standards sorry!","<a href=""http://twitter.com"" rel=""nofollow"">Twitter Web Client</a>",false,,,,620142261,KimKierkegaard,,,,,,,,,,,608,431,,,,,,,,,,,,,false,false,,en,0,134
Fri Feb 21 21:21:43 +0000 2014,436974034522488834,My soul is a hollowness &amp; everything around me is as empty as eternity. Where do I look for fashion inspiration or fun trends?,"<a href=""http://twitter.com"" rel=""nofollow"">Twitter Web Client</a>",false,,,,620142261,KimKierkegaard,,,,,,,,,,,1502,798,,,,,,,,,,,,,false,false,,en,0,134
Tue Feb 11 20:17:30 +0000 2014,433333997431582720,"In order to aspire to the truth, you must shed your thoughts &amp; preconceptions &amp; just put on a good simple cool bikini.","<a href=""http://twitter.com"" rel=""nofollow"">Twitter Web Client</a>",false,,,,620142261,KimKierkegaard,,,,,,,,,,,895,491,,,,,,,,,,,,,false,false,,en,0,126
Fri Dec 27 20:51:12 +0000 2013,416672635443896320,"Hermes Birkin bag, hand painted by George Condo. One of one. Christmas present from Yeezy. I carry it around like a sickness of the spirit.","<a href=""http://twitter.com"" rel=""nofollow"">Twitter Web Client</a>",false,,,,620142261,KimKierkegaard,,,,,,,,,,,1164,766,,,,,,,,,,,,,false,false,,en,0,134
Mon Dec 23 18:41:48 +0000 2013,415190519271403520,RT @MaketheRoadNY: Problem: Holiday shopping exhaustion? Solution: Make it simple by donating to MRNY in honor of someone special: http://t?,"<a href=""http://twitter.com"" rel=""nofollow"">Twitter Web Client</a>",false,,,,620142261,KimKierkegaard,,,,,,,,,,,2,0,,,http://t.co/chc6aNt47f,http://www.maketheroad.org/article.php?ID=3278,140,,,,,MaketheRoadNY,MaketheRoadNewYork,141286022,false,false,false,en,0,134
Wed Dec 18 22:39:52 +0000 2013,413438491041624064,"You exist. You are a human being. The sun shines for you, and your eyebrows are thick, natural and amazing.","<a href=""http://twitter.com"" rel=""nofollow"">Twitter Web Client</a>",false,,,,620142261,KimKierkegaard,,,,,,,,,,,2396,1612,,,,,,,,,,,,,false,false,,en,0,107
Wed Dec 18 21:32:32 +0000 2013,413421546028281856,"Abraham's gaze was terrible. He threw his child to the ground &amp; cried: ""Do people really think I'd wax my daughters eyebrows so young?""","<a href=""http://twitter.com"" rel=""nofollow"">Twitter Web Client</a>",false,,,,620142261,KimKierkegaard,,,,,,,,,,,585,423,,,,,,,,,,,,,false,false,,en,0,134
Sun Dec 15 21:52:02 +0000 2013,412339292745531392,"RT @DavidGrann: In the best end of year book recommendation, Mike Tyson explores Kierkegaard. http://t.co/nzyCdqMqOr","<a href=""http://twitter.com"" rel=""nofollow"">Twitter Web Client</a>",false,,,,620142261,KimKierkegaard,,,,,,,,,,,193,3,,,http://t.co/nzyCdqMqOr,http://on.wsj.com/1hS18QG,116,,,,,DavidGrann,David Grann,584198802,false,false,false,en,0,116
Mon Dec 09 20:45:15 +0000 2013,410148155452178432,It's beginning to look a lot like Christmas. A bankrupt age disguises itself in extravagance.,"<a href=""http://twitter.com"" rel=""nofollow"">Twitter Web Client</a>",false,,,,620142261,KimKierkegaard,,,,,,,,,,,1843,982,,,,,,,,,,,,,false,false,,en,0,93
Mon Dec 09 20:23:08 +0000 2013,410142592811024384,"Try our gorgeous bedding in ""Boudoir"" or ""Animal Luxe"" now that your great dreams have been reduced to witty excuses for remaining in bed.","<a href=""http://twitter.com"" rel=""nofollow"">Twitter Web Client</a>",false,,,,620142261,KimKierkegaard,,,,,,,,,,,338,285,,,,,,,,,,,,,false,false,,en,0,134
Sun Dec 08 16:16:36 +0000 2013,409718161962172416,"RT @mitrakalita: Wire's David Simon on inequality: ""10 or 15% of my country is no longer necessary to the operation of the economy"" http://?","<a href=""http://twitter.com"" rel=""nofollow"">Twitter Web Client</a>",false,,,,620142261,KimKierkegaard,,,,,,,,,,,123,1,,,http://t.co/CwX8KuinYS,http://www.theguardian.com/world/2013/dec/08/david-simon-capitalism-marx-two-americas-wire,140,,,,,mitrakalita,S. Mitra Kalita,17813980,false,false,false,en,0,134
Wed Nov 27 18:39:37 +0000 2013,405767885584211968,"Start searching for the perfect holiday gift &amp; the inauthentic kind of happiness it is capable of producing,","<a href=""http://twitter.com"" rel=""nofollow"">Twitter Web Client</a>",false,,,,620142261,KimKierkegaard,,,,,,,,,,,1349,661,,,,,,,,,,,,,false,false,,en,0,112
Sun Nov 24 22:53:38 +0000 2013,404744649577095168,"RT @GordonMarino: @KimKierkegaard in case Kim needs some fresh quotes. The recently published QUOTABLE KIERKEGAARD
http://t.co/sRYJ6rNgof","<a href=""http://twitter.com"" rel=""nofollow"">Twitter Web Client</a>",false,,,,620142261,KimKierkegaard,,,,,,,,,,,14,0,,,http://t.co/sRYJ6rNgof,http://press.princeton.edu/titles/10061.html,137,,,,,KimKierkegaard,KimKierkegaardashian,620142261,false,false,false,en,0,134
Sun Nov 24 16:12:46 +0000 2013,404643767442886656,"Last night's show was insane!! Kanye sold out the Garden!!! Lost inside the crowd was the eternal truth, the single individual.","<a href=""http://twitter.com"" rel=""nofollow"">Twitter Web Client</a>",false,,,,620142261,KimKierkegaard,,,,,,,,,,,1079,737,,,,,,,,,,,,,false,false,,en,0,127
Sun Nov 24 15:23:18 +0000 2013,404631317590982657,To cheat oneself of love is a deception for which there is no reparation either in time or in eternity. Ride or die girlfriend.,"<a href=""http://twitter.com"" rel=""nofollow"">Twitter Web Client</a>",false,,,,620142261,KimKierkegaard,,,,,,,,,,,1305,754,,,,,,,,,,,,,false,false,,en,0,127
Fri Nov 22 16:08:55 +0000 2013,403918022663880705,"To regard your neighbor as yourself, see that he is as real as yourself. He also wants to look tan &amp; glowy, especially through the holidays.","<a href=""http://twitter.com"" rel=""nofollow"">Twitter Web Client</a>",false,,,,620142261,KimKierkegaard,,,,,,,,,,,547,292,,,,,,,,,,,,,false,false,,en,0,134
Wed Nov 20 04:56:46 +0000 2013,403024092967628801,I've been doing the Atkins diet &amp; luv it. The self is lost by being altogether reduced to the finite.,"<a href=""http://twitter.com"" rel=""nofollow"">Twitter Web Client</a>",false,,,,620142261,KimKierkegaard,,,,,,,,,,,675,393,,,,,,,,,,,,,false,false,,en,0,105
Mon Nov 18 01:33:25 +0000 2013,402248144798248960,I always regret when I try long nails. They remind me too poignantly of the sharp scythe of the reaper.,"<a href=""http://twitter.com"" rel=""nofollow"">Twitter Web Client</a>",false,,,,620142261,KimKierkegaard,,,,,,,,,,,1539,874,,,,,,,,,,,,,false,false,,en,0,103
Mon Nov 18 01:25:55 +0000 2013,402246254258036736,"RT @trevortimm: ""If this were happening in any other country, Americans would be aghast."" http://t.co/zrdyyOhyS7","<a href=""http://twitter.com"" rel=""nofollow"">Twitter Web Client</a>",false,,,,620142261,KimKierkegaard,,,,,,,,,,,257,0,,,http://t.co/zrdyyOhyS7,http://www.nytimes.com/2013/11/17/opinion/sunday/sentenced-to-a-slow-death.html,112,,,,,trevortimm,Trevor Timm,224079521,false,false,false,en,0,112
Thu Nov 14 18:28:48 +0000 2013,401054121333370880,"RT @Justin_Buber: I wanna know what u doin', where u at, where u at? But the Thou is an unknowable unity &amp; not an object to be scrutinized.","<a href=""http://twitter.com"" rel=""nofollow"">Twitter Web Client</a>",false,,,,620142261,KimKierkegaard,,,,,,,,,,,346,0,,,,,,,,,,Justin_Buber,Justin Buber,323009268,false,false,,en,0,134
Tue Nov 12 20:06:30 +0000 2013,400353933358399489,"Birthday in Vegas. Danced all night. One tries in vain to forget one's melancholy in distraction, at a distance from it.","<a href=""http://twitter.com"" rel=""nofollow"">Twitter Web Client</a>",false,,,,620142261,KimKierkegaard,,,,,,,,,,,583,375,,,,,,,,,,,,,false,false,,en,0,120
Tue Nov 12 19:31:51 +0000 2013,400345213849174016,"Swimming pool. Dance floor. Mechanical bull. There is melancholy in everything in my life, but also an indescribable happiness.","<a href=""http://twitter.com"" rel=""nofollow"">Twitter Web Client</a>",false,,,,620142261,KimKierkegaard,,,,,,,,,,,600,357,,,,,,,,,,,,,false,false,,en,0,127
Mon Nov 11 22:54:07 +0000 2013,400033726878732288,RT @Sie7emusic: Help @WFP deliver emergency food relief to the Phillipines: http://t.co/vpAPHqxBzi Or text AID to 27722 to donate$10 http:/?,"<a href=""http://twitter.com"" rel=""nofollow"">Twitter Web Client</a>",false,,,,620142261,KimKierkegaard,,,,,,,,,,,16,0,,,http://t.co/vpAPHqxBzi,http://bit.ly/HF1w5n,98,140,http://pbs.twimg.com/media/BYySsO7IAAA-tp_.jpg,http://t.co/94VzXKyxFT,photo,WFP,World Food Programme,27830610,false,false,false,en,0,134
Mon Nov 11 17:28:57 +0000 2013,399951896024084480,"do u ever want to wake up your baby to give him or her kisses? i want to sooo bad right now, but this too i must suffer  in silence.","<a href=""http://twitter.com"" rel=""nofollow"">Twitter Web Client</a>",false,,,,620142261,KimKierkegaard,,,,,,,,,,,234,237,,,,,,,,,,,,,false,false,,en,0,134
Fri Nov 08 18:03:26 +0000 2013,398873410052186112,What afflicts the adult is the grotesque illusion of having outgrown illusion. I hope you have the best birthday ever.,"<a href=""http://twitter.com"" rel=""nofollow"">Twitter Web Client</a>",false,,,,620142261,KimKierkegaard,,,,,,,,,,,810,584,,,,,,,,,,,,,false,false,,en,0,118
Fri Nov 08 17:58:12 +0000 2013,398872091711115264,"This pump has all the height a girl could ever want, if as a philosopher, your position is not so lofty.","<a href=""http://twitter.com"" rel=""nofollow"">Twitter Web Client</a>",false,,,,620142261,KimKierkegaard,,,,,,,,,,,228,166,,,,,,,,,,,,,false,false,,en,0,104
Tue Oct 29 18:02:28 +0000 2013,395249289892728832,RT @veryhushed: .                                  .         .  .,"<a href=""http://twitter.com"" rel=""nofollow"">Twitter Web Client</a>",false,,,,620142261,KimKierkegaard,,,,,,,,,,,95,0,,,,,,,,,,veryhushed,"silence ",2151669776,false,false,,und,0,65
Sat Oct 05 20:34:22 +0000 2013,386590206477869056,"For what good would it do if the truth stood before me cold and naked, and I gave it a dress pulled off the runway from the Givenchy show?","<a href=""http://twitter.com"" rel=""nofollow"">Twitter Web Client</a>",false,,,,620142261,KimKierkegaard,,,,,,,,,,,626,305,,,,,,,,,,,,,false,false,,en,0,134
Wed Oct 02 13:44:08 +0000 2013,385399803955265536,Thank you for the gorgeous baby gifts! But man's life is not intended for enjoyment.,"<a href=""http://twitter.com"" rel=""nofollow"">Twitter Web Client</a>",false,,,,620142261,KimKierkegaard,,,,,,,,,,,462,288,,,,,,,,,,,,,false,false,,en,0,84
Tue Oct 01 22:18:17 +0000 2013,385166805494296576,My dates tonight: mortification and solitude.,"<a href=""http://twitter.com"" rel=""nofollow"">Twitter Web Client</a>",false,,,,620142261,KimKierkegaard,,,,,,,,,,,816,515,,,,,,,,,,,,,false,false,,en,0,45
